{
  "templateId": "audit-report",
  "documentType": "Audit Report",
  "documentTypeKm": "TODO: Add Khmer name",
  "mustWrite": [
    "Kingdom of Cambodia header",
    "Ministry/department identification",
    "Proper date format in Khmer",
    "Formal tone throughout"
  ],
  "mustNotWrite": [
    "Informal language or slang",
    "Unauthorized commitments",
    "Content beyond signer authorization level"
  ],
  "toneGuidelines": {
    "register": "formal",
    "honorifics": "Use proper titles: ឯកឧត្តម, លោក, លោកស្រី",
    "voice": "Institutional third person",
    "politeness": "High formal"
  },
  "structureRules": {},
  "complianceChecks": [
    "Reference number format valid",
    "Date format matches standard",
    "Language register consistent"
  ]
}
