{
  "templateId": "fsa-notify",
  "documentType": "FSA Notification Letter",
  "documentTypeKm": "លិខិតជម្រាបជូន",
  "mustWrite": [
    "Kingdom of Cambodia header",
    "NBFSA letterhead",
    "Proper salutation and closing",
    "Formal tone throughout"
  ],
  "mustNotWrite": [
    "Informal language or slang",
    "Unauthorized commitments"
  ],
  "toneGuidelines": {
    "register": "formal",
    "honorifics": "Use proper titles: ឯកឧត្តម, លោក, លោកស្រី",
    "voice": "Institutional third person",
    "politeness": "High formal"
  },
  "structureRules": {},
  "complianceChecks": [
    "Reference number format valid",
    "Date format matches standard",
    "Language register consistent"
  ]
}
