{
  "templateId": "fsa-report",
  "documentType": "FSA Report",
  "documentTypeKm": "របាយការណ៍",
  "mustWrite": [
    "Kingdom of Cambodia header",
    "NBFSA letterhead",
    "Executive summary",
    "Reporting period clearly stated",
    "Formal tone throughout"
  ],
  "mustNotWrite": [
    "Informal language or slang",
    "Unverified claims"
  ],
  "toneGuidelines": {
    "register": "formal",
    "honorifics": "Use proper titles: ឯកឧត្តម, លោក, លោកស្រី",
    "voice": "Institutional third person",
    "politeness": "High formal"
  },
  "structureRules": {},
  "complianceChecks": [
    "Period format valid",
    "Author list present",
    "Language register consistent"
  ]
}
