{
  "templateId": "fsa-briefing",
  "documentType": "FSA Case Briefing Memo",
  "documentTypeKm": "бһҖбҹҶбһҺбһҸбҹӢбһ”бһ„бҹ’бһ бһ¶бһүбһҡбһҝбһ„",
  "mustWrite": [
    "Kingdom of Cambodia header",
    "NBFSA letterhead (бһўбһӮбҹ’бһӮбһӣбҹҒбһҒбһ¶бһ’бһ·бһҖбһ¶бһҡбһҠбҹ’бһӢбһ¶бһ“бһўбһ¶бһҮбҹ’бһүбһ¶бһ’бһҡбһҹбҹҒбһңбһ¶бһ бһ·бһҡбһүбҹ’бһүбһңбһҸбҹ’бһҗбһ»бһҳбһ·бһ“бһҳбҹӮбһ“бһ’бһ“бһ¶бһӮбһ¶бһҡ)",
    "Clear background / findings / recommendation sections",
    "Proper date format in Khmer",
    "Formal tone throughout"
  ],
  "mustNotWrite": [
    "Informal language or slang",
    "Unauthorized commitments",
    "Content beyond signer authorization level"
  ],
  "toneGuidelines": {
    "register": "formal",
    "honorifics": "Use proper titles: бһҜбһҖбһ§бһҸбҹ’бһҸбһҳ, бһӣбҹ„бһҖ, бһӣбҹ„бһҖбһҹбҹ’бһҡбһё",
    "voice": "Institutional third person",
    "politeness": "High formal"
  },
  "structureRules": {},
  "complianceChecks": [
    "Reference number format valid",
    "Date format matches standard",
    "Language register consistent"
  ]
}
